{"bundle_hash":"0e56fa55a4fe451fe79bf02579be3031d1bd6b5cc5fef0a03ad0cde4f22ff505","details":{},"format":"meta_core_receipt_v1","kernel_hash":"f563ef18368ba83721b26693eac7b02d4af85ba1036b6669b02c683db6660acf","meta_hash":"92a5ed9065f8303e41b3862562259ceb3f2ba7f707af67912fac2fa6df53201b","reason_code":"OK","schema_version":"1","toolchain_merkle_root":"cc1886cdadd450cb35ac0654f64d3b97084422d174eda2026166b65809832111","verdict":"VALID"}